[
  {
    "id": "jca-no53-F1",
    "title": "Sub tuum praesidium（1545a）",
    "title_yomi": null,
    "composer": "Giovannni Pierluigi da Palestrina",
    "lyricist": null,
    "original_author": null,
    "arranger": null,
    "is_arrangement": false,
    "collection": null,
    "voicing_category": "女声",
    "voicing_detail": null,
    "language": "la",
    "accompaniment": null,
    "source_type": "コンクール課題曲",
    "source_detail": {
      "contest_year": 2025,
      "contest_round": null,
      "edition_no": 53,
      "piece_code": "F1"
    },
    "publisher": "全日本合唱連盟",
    "tags": [],
    "notes": null,
    "needs_review": true,
    "confidence": 0.5,
    "sources": [
      {
        "url": "https://jcanet.or.jp/Public/meikyoku/meikyoku-No53.htm",
        "retrieved_at": "2026-06-22T00:00:00+00:00",
        "raw_text": "Sub tuum praesidium（1545a） Giovannni Pierluigi da Palestrina曲"
      }
    ],
    "created_at": "2026-06-22T00:00:00+00:00",
    "updated_at": "2026-06-22T00:00:00+00:00"
  },
  {
    "id": "jca-no53-F2",
    "title": "Die Capelle Johann Ludwig Uhland",
    "title_yomi": null,
    "composer": "Robert Schumann",
    "lyricist": null,
    "original_author": null,
    "arranger": null,
    "is_arrangement": false,
    "collection": null,
    "voicing_category": "女声",
    "voicing_detail": null,
    "language": "de",
    "accompaniment": null,
    "source_type": "コンクール課題曲",
    "source_detail": {
      "contest_year": 2025,
      "contest_round": null,
      "edition_no": 53,
      "piece_code": "F2"
    },
    "publisher": "全日本合唱連盟",
    "tags": [],
    "notes": null,
    "needs_review": true,
    "confidence": 0.4,
    "sources": [
      {
        "url": "https://jcanet.or.jp/Public/meikyoku/meikyoku-No53.htm",
        "retrieved_at": "2026-06-22T00:00:00+00:00",
        "raw_text": "Die Capelle Johann Ludwig Uhland詩／Robert Schumann曲"
      }
    ],
    "created_at": "2026-06-22T00:00:00+00:00",
    "updated_at": "2026-06-22T00:00:00+00:00"
  },
  {
    "id": "jca-no53-F3",
    "title": "T",
    "title_yomi": null,
    "composer": "間宮芳生",
    "lyricist": "草野心平",
    "original_author": null,
    "arranger": null,
    "is_arrangement": false,
    "collection": "Motet Vernale",
    "voicing_category": "女声",
    "voicing_detail": null,
    "language": null,
    "accompaniment": null,
    "source_type": "コンクール課題曲",
    "source_detail": {
      "contest_year": 2025,
      "contest_round": null,
      "edition_no": 53,
      "piece_code": "F3"
    },
    "publisher": "全日本合唱連盟",
    "tags": [],
    "notes": null,
    "needs_review": false,
    "confidence": 0.95,
    "sources": [
      {
        "url": "https://jcanet.or.jp/Public/meikyoku/meikyoku-No53.htm",
        "retrieved_at": "2026-06-22T00:00:00+00:00",
        "raw_text": "T（「Motet Vernale」から） 草野心平詩／間宮芳生曲"
      }
    ],
    "created_at": "2026-06-22T00:00:00+00:00",
    "updated_at": "2026-06-22T00:00:00+00:00"
  },
  {
    "id": "jca-no53-F4",
    "title": "かつて私は信じていた",
    "title_yomi": null,
    "composer": "平木悟",
    "lyricist": "菅原敏",
    "original_author": "Heinrich Heine",
    "arranger": null,
    "is_arrangement": false,
    "collection": "世界恋愛詩集",
    "voicing_category": "女声",
    "voicing_detail": null,
    "language": null,
    "accompaniment": "ピアノ伴奏",
    "source_type": "コンクール課題曲",
    "source_detail": {
      "contest_year": 2025,
      "contest_round": null,
      "edition_no": 53,
      "piece_code": "F4"
    },
    "publisher": "全日本合唱連盟",
    "tags": [],
    "notes": null,
    "needs_review": false,
    "confidence": 0.95,
    "sources": [
      {
        "url": "https://jcanet.or.jp/Public/meikyoku/meikyoku-No53.htm",
        "retrieved_at": "2026-06-22T00:00:00+00:00",
        "raw_text": "かつて私は信じていた（「世界恋愛詩集」から） 菅原敏詩（原文：Heinrich Heine）／平木悟曲"
      }
    ],
    "created_at": "2026-06-22T00:00:00+00:00",
    "updated_at": "2026-06-22T00:00:00+00:00"
  },
  {
    "id": "jca-no53-G1",
    "title": "Dies sanctificatus（1563）",
    "title_yomi": null,
    "composer": "Giovannni Pierluigi da Palestrina",
    "lyricist": null,
    "original_author": null,
    "arranger": null,
    "is_arrangement": false,
    "collection": null,
    "voicing_category": "混声",
    "voicing_detail": null,
    "language": "la",
    "accompaniment": null,
    "source_type": "コンクール課題曲",
    "source_detail": {
      "contest_year": 2025,
      "contest_round": null,
      "edition_no": 53,
      "piece_code": "G1"
    },
    "publisher": "全日本合唱連盟",
    "tags": [],
    "notes": null,
    "needs_review": true,
    "confidence": 0.5,
    "sources": [
      {
        "url": "https://jcanet.or.jp/Public/meikyoku/meikyoku-No53.htm",
        "retrieved_at": "2026-06-22T00:00:00+00:00",
        "raw_text": "Dies sanctificatus（1563） Giovannni Pierluigi da Palestrina曲"
      }
    ],
    "created_at": "2026-06-22T00:00:00+00:00",
    "updated_at": "2026-06-22T00:00:00+00:00"
  },
  {
    "id": "jca-no53-G2",
    "title": "Das edle",
    "title_yomi": null,
    "composer": "Anton Bruckner",
    "lyricist": "Herz Ernst Marinelli",
    "original_author": null,
    "arranger": null,
    "is_arrangement": false,
    "collection": null,
    "voicing_category": "混声",
    "voicing_detail": null,
    "language": "de",
    "accompaniment": null,
    "source_type": "コンクール課題曲",
    "source_detail": {
      "contest_year": 2025,
      "contest_round": null,
      "edition_no": 53,
      "piece_code": "G2"
    },
    "publisher": "全日本合唱連盟",
    "tags": [],
    "notes": null,
    "needs_review": true,
    "confidence": 0.5,
    "sources": [
      {
        "url": "https://jcanet.or.jp/Public/meikyoku/meikyoku-No53.htm",
        "retrieved_at": "2026-06-22T00:00:00+00:00",
        "raw_text": "Das edle Herz Ernst Marinelli詩／Anton Bruckner曲"
      }
    ],
    "created_at": "2026-06-22T00:00:00+00:00",
    "updated_at": "2026-06-22T00:00:00+00:00"
  },
  {
    "id": "jca-no53-G3",
    "title": "秋の午後",
    "title_yomi": null,
    "composer": "萩原英彦",
    "lyricist": "矢澤宰",
    "original_author": null,
    "arranger": null,
    "is_arrangement": false,
    "collection": "光る砂漠",
    "voicing_category": "混声",
    "voicing_detail": null,
    "language": null,
    "accompaniment": "ピアノ伴奏",
    "source_type": "コンクール課題曲",
    "source_detail": {
      "contest_year": 2025,
      "contest_round": null,
      "edition_no": 53,
      "piece_code": "G3"
    },
    "publisher": "全日本合唱連盟",
    "tags": [],
    "notes": null,
    "needs_review": false,
    "confidence": 0.95,
    "sources": [
      {
        "url": "https://jcanet.or.jp/Public/meikyoku/meikyoku-No53.htm",
        "retrieved_at": "2026-06-22T00:00:00+00:00",
        "raw_text": "秋の午後（「光る砂漠」から） 矢澤宰詩／萩原英彦曲"
      }
    ],
    "created_at": "2026-06-22T00:00:00+00:00",
    "updated_at": "2026-06-22T00:00:00+00:00"
  },
  {
    "id": "jca-no53-G4",
    "title": "不思議",
    "title_yomi": null,
    "composer": "石若雅弥",
    "lyricist": "金子みすゞ",
    "original_author": null,
    "arranger": null,
    "is_arrangement": false,
    "collection": "不思議",
    "voicing_category": "混声",
    "voicing_detail": null,
    "language": null,
    "accompaniment": null,
    "source_type": "コンクール課題曲",
    "source_detail": {
      "contest_year": 2025,
      "contest_round": null,
      "edition_no": 53,
      "piece_code": "G4"
    },
    "publisher": "全日本合唱連盟",
    "tags": [],
    "notes": null,
    "needs_review": false,
    "confidence": 0.95,
    "sources": [
      {
        "url": "https://jcanet.or.jp/Public/meikyoku/meikyoku-No53.htm",
        "retrieved_at": "2026-06-22T00:00:00+00:00",
        "raw_text": "不思議（「不思議」から） 金子みすゞ詩／石若雅弥曲"
      }
    ],
    "created_at": "2026-06-22T00:00:00+00:00",
    "updated_at": "2026-06-22T00:00:00+00:00"
  },
  {
    "id": "jca-no53-M1",
    "title": "Ascendens Christus in altum",
    "title_yomi": null,
    "composer": "Giovannni Pierluigi da Palestrina",
    "lyricist": null,
    "original_author": null,
    "arranger": null,
    "is_arrangement": false,
    "collection": null,
    "voicing_category": "男声",
    "voicing_detail": null,
    "language": "la",
    "accompaniment": null,
    "source_type": "コンクール課題曲",
    "source_detail": {
      "contest_year": 2025,
      "contest_round": null,
      "edition_no": 53,
      "piece_code": "M1"
    },
    "publisher": "全日本合唱連盟",
    "tags": [],
    "notes": null,
    "needs_review": true,
    "confidence": 0.5,
    "sources": [
      {
        "url": "https://jcanet.or.jp/Public/meikyoku/meikyoku-No53.htm",
        "retrieved_at": "2026-06-22T00:00:00+00:00",
        "raw_text": "Ascendens Christus in altum Giovannni Pierluigi da Palestrina曲"
      }
    ],
    "created_at": "2026-06-22T00:00:00+00:00",
    "updated_at": "2026-06-22T00:00:00+00:00"
  },
  {
    "id": "jca-no53-M2",
    "title": "Geistesgruß Johann Wolfgang von Goethe",
    "title_yomi": null,
    "composer": "Hugo Wolf",
    "lyricist": null,
    "original_author": null,
    "arranger": null,
    "is_arrangement": false,
    "collection": "Drei Lieder",
    "voicing_category": "男声",
    "voicing_detail": null,
    "language": "de",
    "accompaniment": null,
    "source_type": "コンクール課題曲",
    "source_detail": {
      "contest_year": 2025,
      "contest_round": null,
      "edition_no": 53,
      "piece_code": "M2"
    },
    "publisher": "全日本合唱連盟",
    "tags": [],
    "notes": null,
    "needs_review": true,
    "confidence": 0.4,
    "sources": [
      {
        "url": "https://jcanet.or.jp/Public/meikyoku/meikyoku-No53.htm",
        "retrieved_at": "2026-06-22T00:00:00+00:00",
        "raw_text": "Geistesgruß（「Drei Lieder」から） Johann Wolfgang von Goethe詩／Hugo Wolf曲"
      }
    ],
    "created_at": "2026-06-22T00:00:00+00:00",
    "updated_at": "2026-06-22T00:00:00+00:00"
  },
  {
    "id": "jca-no53-M3",
    "title": "彼岸花",
    "title_yomi": null,
    "composer": "多田武彦",
    "lyricist": "北原白秋",
    "original_author": null,
    "arranger": null,
    "is_arrangement": false,
    "collection": "雪と花火",